{
  "$schema": "../mfm-source-map.schema.json",
  "entity_schema": "schemas/core/mission.schema.json",
  "mapping_version": 1,
  "root_tables": [
    "primary_mission"
  ],
  "fields": {
    "/deployment_pattern_ids": {
      "provenance": "unresolved-candidate",
      "coverage": "unimplemented",
      "sources": [
        "data.primary_mission.missionPackId",
        "data.mission_layout.id",
        "data.mission_deployment.id",
        "data.mission_layout_linked_deployment.missionLayoutId",
        "data.mission_layout_linked_deployment.missionDeploymentId"
      ],
      "joins": [
        {
          "relation": "primary_mission.missionPackId",
          "direction": "parent",
          "purpose": "general"
        },
        {
          "relation": "mission_layout.missionPackId",
          "direction": "parent",
          "purpose": "ownership"
        },
        {
          "relation": "mission_deployment.missionPackId",
          "direction": "parent",
          "purpose": "ownership"
        },
        {
          "relation": "mission_layout_linked_deployment.missionLayoutId",
          "direction": "parent",
          "purpose": "applicability"
        },
        {
          "relation": "mission_layout_linked_deployment.missionDeploymentId",
          "direction": "parent",
          "purpose": "applicability"
        }
      ],
      "transforms": [],
      "filters": [
        "A shared mission-pack membership and layout-to-deployment applicability edge do not establish a per-primary-mission deployment pairing."
      ],
      "precedence": [],
      "consumers": [],
      "reason": "The dump has mission-pack-scoped layouts and deployments, but no verified relation assigning a deployment pattern to an individual primary mission."
    },
    "/deployment_pattern_ids/*": {
      "provenance": "unresolved-candidate",
      "coverage": "unimplemented",
      "sources": [
        "data.primary_mission.missionPackId",
        "data.mission_layout.id",
        "data.mission_deployment.id",
        "data.mission_layout_linked_deployment.missionLayoutId",
        "data.mission_layout_linked_deployment.missionDeploymentId"
      ],
      "joins": [
        {
          "relation": "primary_mission.missionPackId",
          "direction": "parent",
          "purpose": "general"
        },
        {
          "relation": "mission_layout.missionPackId",
          "direction": "parent",
          "purpose": "ownership"
        },
        {
          "relation": "mission_deployment.missionPackId",
          "direction": "parent",
          "purpose": "ownership"
        },
        {
          "relation": "mission_layout_linked_deployment.missionLayoutId",
          "direction": "parent",
          "purpose": "applicability"
        },
        {
          "relation": "mission_layout_linked_deployment.missionDeploymentId",
          "direction": "parent",
          "purpose": "applicability"
        }
      ],
      "transforms": [],
      "filters": [
        "A shared mission-pack membership and layout-to-deployment applicability edge do not establish a per-primary-mission deployment pairing."
      ],
      "precedence": [],
      "consumers": [],
      "reason": "No current extractor converts dump layouts or deployments into deployment-pattern entity IDs for an individual primary mission."
    },
    "/description": {
      "provenance": "prose-store-only",
      "coverage": "unimplemented",
      "sources": [
        "data.primary_mission.localisations.*.description",
        "data.primary_mission.localisations.*.lore"
      ],
      "joins": [],
      "transforms": [],
      "filters": [],
      "precedence": [],
      "consumers": [],
      "reason": "Mission description and lore are GW prose; the core field requires an original community-authored summary and the missions ingest never copies prose."
    },
    "/game_version": {
      "provenance": "repo-authored",
      "coverage": "unimplemented",
      "sources": [],
      "joins": [],
      "transforms": [],
      "filters": [],
      "precedence": [],
      "consumers": [],
      "reason": "Edition and dataslate labels are repository release context, not derived from a primary-mission dump row."
    },
    "/game_version/dataslate": {
      "provenance": "repo-authored",
      "coverage": "unimplemented",
      "sources": [],
      "joins": [],
      "transforms": [],
      "filters": [],
      "precedence": [],
      "consumers": [],
      "reason": "The dataslate label is authored repository release context."
    },
    "/game_version/edition": {
      "provenance": "repo-authored",
      "coverage": "unimplemented",
      "sources": [],
      "joins": [],
      "transforms": [],
      "filters": [],
      "precedence": [],
      "consumers": [],
      "reason": "The edition label is authored repository release context."
    },
    "/id": {
      "provenance": "derived",
      "coverage": "partial",
      "sources": [
        "data.primary_mission.id",
        "data.primary_mission.detachmentId",
        "data.primary_mission.localisations.*.name"
      ],
      "joins": [],
      "transforms": [
        {
          "symbol": "tools/src/converters/id-generator.ts#nameToId",
          "operation": "Normalize the English primary-mission display name to the repository mission identifier."
        }
      ],
      "filters": [
        "Use only primary_mission rows with detachmentId null.",
        "Require both the dump row identity and an English display name."
      ],
      "precedence": [
        "The normalized English display name is the repository identifier; the dump ID is retained only for relational scoring lookup."
      ],
      "consumers": [
        "tools/src/mfm/missions.ts#buildMissionScoringCanon",
        "tools/src/mfm/missions.ts#missionInventory"
      ],
      "reason": "Missions.ts recognizes generic primary missions by normalized English name for scoring-card reconciliation, but it does not write mission entities."
    },
    "/name": {
      "provenance": "direct",
      "coverage": "partial",
      "sources": [
        "data.primary_mission.detachmentId",
        "data.primary_mission.localisations.*.name"
      ],
      "joins": [],
      "transforms": [],
      "filters": [
        "Use only primary_mission rows with detachmentId null.",
        "Use the English localized display name."
      ],
      "precedence": [],
      "consumers": [
        "tools/src/mfm/missions.ts#buildMissionScoringCanon",
        "tools/src/mfm/missions.ts#missionInventory"
      ],
      "reason": "The current mission ingest uses the generic primary-mission English name to match scoring cards, rather than projecting a mission entity record."
    },
    "/source": {
      "provenance": "unresolved-candidate",
      "coverage": "unimplemented",
      "sources": [
        "data.primary_mission.missionPackId",
        "data.mission_pack.localisations.*.name"
      ],
      "joins": [
        {
          "relation": "primary_mission.missionPackId",
          "direction": "parent",
          "purpose": "general"
        }
      ],
      "transforms": [],
      "filters": [],
      "precedence": [],
      "consumers": [],
      "reason": "The primary mission belongs to a mission pack, but no reviewed transformation establishes that the mission-pack display name is the core source label."
    },
    "/vp_per_game_cap": {
      "provenance": "repo-authored",
      "coverage": "unimplemented",
      "sources": [],
      "joins": [],
      "transforms": [],
      "filters": [],
      "precedence": [
        "Retain the schema's authored default of 45."
      ],
      "consumers": [],
      "reason": "The dump score limit is mission-pack-global rather than a per-primary-mission cap, and missions.ts does not reconcile this field."
    },
    "/vp_per_round_cap": {
      "provenance": "repo-authored",
      "coverage": "unimplemented",
      "sources": [],
      "joins": [],
      "transforms": [],
      "filters": [],
      "precedence": [
        "Retain the schema's authored default of 15."
      ],
      "consumers": [],
      "reason": "The dump score limit is mission-pack-global rather than a per-primary-mission cap, and missions.ts does not reconcile this field."
    }
  },
  "unmapped_mfm_fields": [
    {
      "source": "data.primary_mission.localisations.*.agendaAchievedText",
      "candidate_pointer": null,
      "reason": "Agenda-completion prose has no core mission destination and must not be copied from the dump."
    },
    {
      "source": "data.mission_pack.primaryMissionScoreGameLimit",
      "candidate_pointer": "/vp_per_game_cap",
      "reason": "This is a mission-pack-global limit, not a verified per-mission value; the core field retains its authored default."
    },
    {
      "source": "data.mission_pack.primaryMissionScoreBattleRoundLimit",
      "candidate_pointer": "/vp_per_round_cap",
      "reason": "This is a mission-pack-global limit, not a verified per-mission value; the core field retains its authored default."
    }
  ]
}
